<?xml version="1.0" encoding="UTF-8"?>
<!--Sample XML file generated by XMLSpy v2014 rel. 2 sp1 (x64) (http://www.altova.com) -->
<PACKAGES xmlns:xsi="http://www.w3.org/2001/XMLSchema-instance" packagesCount="String" xsi:noNamespaceSchemaLocation="SearchAPISchema.xsd">
	<PACKAGE>
		<OFFERINFO date="2014-10-27" stay="5" priceTotal="1202.00" pricePerPerson="601.00" deposit="601.00" coachTransfer="true"
			carHire="true" worldCare="true" />
		<HOTELINFO brand="F" id="2843" commercialPriority="251" />
		<ROOMINFO roomTypeName="DoubleBedRoom" roomCode="AQ013" availability="true" priceTotal="1202.00" pricePerPerson="601.00"
			discountTotal="601.00" discountPerPerson="140.00" defaultBoard="AI">
			<PARTYINFO adults="2" children="0" infant="0" seniors="0" />
		</ROOMINFO>
		<ROOMINFO roomTypeName="SingleBedRoom" roomCode="AQ014" availability="true" priceTotal="601.00" pricePerPerson="300.00"
			discountTotal="300.00" discountPerPerson="140.00" defaultBoard="AI">
			<PARTYINFO adults="2" children="0" infant="0" seniors="0" />
		</ROOMINFO>
		<BOARDINFO boardCode="BB" boardPrice="1500.00" />
		<FLIGHTINFO departurePort="GLA" departureDate="2014-10-27" departureTime="0720" arrivalPort="LPA" arrivalDate="2014-10-30"
			arrivalTime="1200" availability="25" flightNo="TOM1100" airplaneCode="String" dreamliner="true" car="true" meals="true"
			routeOptionCode="String" routeOptionAvailability="String" pricePerAdult="String" pricePerChildren="String" flightType="OUTBOUND" />

		<FLIGHTINFO departurePort="LPA" departureDate="2014-10-30" departureTime="2130" arrivalPort="GLA" arrivalDate="2014-10-30"
			arrivalTime="0210" availability="35" flightNo="TOM1601" airplaneCode="String" dreamliner="true" car="true" meals="true"
			routeOptionCode="String" routeOptionAvailability="String" pricePerAdult="String" pricePerChildren="String" flightType="INBOUND" />
		<DURATIONDATESINFO>
			<AVAILABLEDURATIONS durations="7" />
			<CALENDARINFO date="2014-10-30" availability="true" />
		</DURATIONDATESINFO>
		<RATINGREVIEWSINFO rating="5" reviews="String" percentage="0" category="String" />
	</PACKAGE>
	<FACETINFO categoryCode="AF0001">
		<FACET code="AF0001" count="88" min="3.0" max="5.0" />
	</FACETINFO>
	<FACETINFO categoryCode="FT000F">
		<FACET code="LST1" count="2" />
		<FACET code="ST3" count="7" />
		<FACET code="STF11" count="2" />
		<FACET code="STF7" count="2" />
		<FACET code="STF3" count="1" />
		<FACET code="STF9" count="1" />
	</FACETINFO>
	<FACETINFO categoryCode="FT000H">
		<FACET code="ST14" count="5" />
		<FACET code="ST4" count="2" />
		<FACET code="ST37" count="1" />
		<FACET code="LST28" count="2" />
	</FACETINFO>
	<FACETINFO categoryCode="FT000P">
		<FACET code="ST23" count="5" />
		<FACET code="STP8" count="8" />
	</FACETINFO>
	<FACETINFO categoryCode="FT000S">
		<FACET code="ST11" count="1" />
		<FACET code="ST25" count="1" />
		<FACET code="ST42" count="7" />
		<FACET code="ST29" count="6" />
		<FACET code="STS3" count="5" />
		<FACET code="ST35" count="2" />
	</FACETINFO>
	<FACETINFO categoryCode="AF0002">
		<FACET code="P00057" count="3" />
		<FACET code="P00053" count="1" />
		<FACET code="Beach" count="1" />
		<FACET code="P00052" count="2" />
		<FACET code="P00050" count="2" />
		<FACET code="P00056" count="1" />
		<FACET code="P00060" count="1" />
	</FACETINFO>
	<FACETINFO categoryCode="FT000O">
		<FACET code="ST20" count="6" />
		<FACET code="STO2" count="2" />
		<FACET code="STO7" count="1" />
	</FACETINFO>
	<FACETINFO categoryCode="FT000E">
		<FACET code="ST8" count="7" />
		<FACET code="LST51" count="2" />
		<FACET code="ST22" count="7" />
		<FACET code="ST7" count="1" />
	</FACETINFO>
</PACKAGES>